{
  "$schema": "https://json-schema.org/draft/2020-12/schema",
  "$id": "spectracer/specification.schema.json",
  "title": "SpecTracer canonical specification (Issue #14)",
  "description": "根（Issue #11 の凍結事項 F1-F12 と Owner 裁定）・要求・要件定義・基本仕様・詳細仕様・基本設計・詳細設計の正典。md/GitHub はここからの一方向エクスポート元。source / cites は移行期間限定の field（Issue #14 コメント 2026-09-04 の却下リスト）。2026-09-05: 基本仕様と詳細設計の間に詳細仕様（detailed_spec, DS-）と基本設計（basic_design, BD-）を挿入（Owner の層分割）。同日: request 以外の全層（require/spec/detailed_spec/basic_design/design）を designArea から再帰的な section 木（見出し番号から機械的に構築）へ一般化。area 接頭辞 DA-/BDA-/DSA- は廃止し、節 id は <層接頭辞>-S### に統一。同日: 要件定義の導出表が自ら「第I部（根 → 要求）」と宣言しているため、根の層 root（ROOT-, Issue #11 の F1-F12 + Owner 裁定、derived_from を持たない唯一の層）を request のさらに上流に追加。request は rootItem から derivedItem へ移行し、root だけが根になる。",
  "type": "object",
  "required": ["schema_version", "root", "request", "require", "spec", "detailed_spec", "basic_design", "design"],
  "additionalProperties": false,
  "properties": {
    "schema_version": { "type": "string", "const": "0.1" },
    "root":           { "type": "array", "items": { "$ref": "#/$defs/rootItem" } },
    "request":        { "type": "array", "items": { "$ref": "#/$defs/derivedItem" } },
    "require":        { "type": "array", "items": { "$ref": "#/$defs/section" } },
    "spec":           { "type": "array", "items": { "$ref": "#/$defs/section" } },
    "detailed_spec":  { "type": "array", "items": { "$ref": "#/$defs/section" } },
    "basic_design":   { "type": "array", "items": { "$ref": "#/$defs/section" } },
    "design":         { "type": "array", "items": { "$ref": "#/$defs/section" } }
  },
  "$defs": {
    "id": { "type": "string", "pattern": "^(ROOT-[0-9]{3,}|R-[0-9]+|P-[0-9]{3}|REQ-[0-9]{3,}|REQ-S[0-9]{3,}|SPEC-[0-9]{3,}|SPEC-S[0-9]{3,}|DS-[0-9]{3,}|DS-S[0-9]{3,}|BD-[0-9]{3,}|BD-S[0-9]{3,}|DES-[0-9]{3,}|DES-S[0-9]{3,})$" },
    "source": {
      "description": "移行期間限定。元 md のどこから写したか。lines は statement と description の両方を含む行範囲（1 始まり、両端含む）。",
      "type": "object",
      "required": ["doc", "heading", "lines"],
      "additionalProperties": false,
      "properties": {
        "doc":     { "type": "string", "minLength": 1 },
        "heading": { "type": "string", "minLength": 1 },
        "lines":   { "type": "array", "items": { "type": "integer", "minimum": 1 }, "minItems": 2, "maxItems": 2 }
      }
    },
    "rootItem": {
      "description": "root 層専用（2026-09-05）。Issue #11 の凍結事項 F1-F12、または要件定義の導出表に上流として現れる Owner 裁定など。系の根なので derived_from を持たない唯一の層。",
      "type": "object",
      "required": ["id", "statement", "source"],
      "additionalProperties": false,
      "properties": {
        "id":          { "$ref": "#/$defs/id" },
        "statement":   { "type": "string", "minLength": 1 },
        "description": { "type": "string" },
        "source":      { "$ref": "#/$defs/source" }
      }
    },
    "derivedItem": {
      "type": "object",
      "required": ["id", "statement", "derives_from", "source"],
      "additionalProperties": false,
      "properties": {
        "id":           { "$ref": "#/$defs/id" },
        "statement":    { "type": "string", "minLength": 1 },
        "description":  { "type": "string" },
        "derives_from": { "type": "array", "items": { "$ref": "#/$defs/id" }, "uniqueItems": true },
        "cites": {
          "description": "移行期間限定。元 md に書かれていた上流引用の逐語（例: \"基本仕様 §3.2\", \"（R-1）\", \"要件定義 L324\"）。derived_from へ解決するのは別工程で、Owner の承認を経る。",
          "type": "array",
          "items": { "type": "string", "minLength": 1 }
        },
        "source":       { "$ref": "#/$defs/source" }
      }
    },
    "section": {
      "description": "文書 > 節 > 小節 > 文の木の1ノード。見出し番号から build 時に機械的に構築される（fragments には保存しない）。derived_from は文にも節にも付きうる（節の辺 = トレーサビリティ表・要求→要件 導出表の行、文の辺 = 文中の cites）。子を持ち自分自身は文を持たない節（見出し番号はあるが直下の item がない）も存在してよい。",
      "type": "object",
      "required": ["id", "title", "source"],
      "additionalProperties": false,
      "properties": {
        "id":           { "$ref": "#/$defs/id" },
        "title":        { "type": "string", "minLength": 1 },
        "description":  { "type": "string" },
        "source":       { "$ref": "#/$defs/source" },
        "derives_from": { "type": "array", "items": { "$ref": "#/$defs/id" }, "uniqueItems": true },
        "sections":     { "type": "array", "items": { "$ref": "#/$defs/section" } },
        "items":        { "type": "array", "items": { "$ref": "#/$defs/derivedItem" } }
      }
    }
  }
}
