{
  "schema_version": "0.1",
  "root": [
    {
      "id": "ROOT-027",
      "statement": "### F1. プロダクトの一次場面 (Q1)\n- 一次ユーザーは開発者自身。守る瞬間は **AI の完了宣言の受領時**。\n- 救うのは「嘘の PASS を信じてマージすること」。\n- 帰結: MCP インターフェースは飾りではなく本体側(エージェントのループ内で嘘を止めるのが目的のため)。",
      "source": {
        "doc": "github:YmSaki/SpecTracer/issues/11",
        "heading": "F1",
        "lines": [
          1,
          1
        ]
      }
    },
    {
      "id": "ROOT-028",
      "statement": "### F2. 過少実装と過実装の統合 (Q2)\n- 未達の完了報告(過少)と過実装は「宣言された要求量に対する過不足」として **単一検査に統合**。区別不能というより同一差分の両側。",
      "source": {
        "doc": "github:YmSaki/SpecTracer/issues/11",
        "heading": "F2",
        "lines": [
          2,
          2
        ]
      }
    },
    {
      "id": "ROOT-029",
      "statement": "### F3. 検査は2トレース。第3の検査は存在しない (Q3–Q4)\n- 順方向トレース: 宣言 → 証拠。\n- 逆方向トレース: 実装 → 宣言(過実装検出)。\n- 「テスト仕様と実装の比較」という第3の検査は定義を試みた結果、順方向トレースに溶けて消滅。**幻だったと確定**。\n- テスト合否の判定権威は cargo test に全面委譲。vtest は結果を証拠として消費するのみ(内部呼び出しはするが判定はしない)。",
      "source": {
        "doc": "github:YmSaki/SpecTracer/issues/11",
        "heading": "F3",
        "lines": [
          3,
          3
        ]
      }
    },
    {
      "id": "ROOT-030",
      "statement": "### F4. 分解不良の扱い (Q2/Q4)\n- 「宣言されていない義務」を発見する **知能は載せない**。発見を可能にする **データ形態** (要求該当箇所と対応概念のペアの構造化出力) までが vtest の責務。\n- 発見者は外部(エージェントまたは人間)。",
      "source": {
        "doc": "github:YmSaki/SpecTracer/issues/11",
        "heading": "F4",
        "lines": [
          4,
          4
        ]
      }
    },
    {
      "id": "ROOT-031",
      "statement": "### F5. 証拠のハッシュ束縛 (Q5–Q6)\n- 証拠は検証対象の **内容ハッシュに束縛** される。現在のソースのハッシュと一致しない証拠は、検証時に「存在しないもの」として扱う。\n- 帰結: 鮮度は独立検査ではなく **設計制約** に吸収。STALE 検出ロジックは書かない。fail-closed の「証拠なし ≠ PASS」が全ケースを拾う。\n- 証拠ストアはハッシュキー必須。",
      "source": {
        "doc": "github:YmSaki/SpecTracer/issues/11",
        "heading": "F5",
        "lines": [
          5,
          5
        ]
      }
    },
    {
      "id": "ROOT-032",
      "statement": "### F6. STALE の降格 (Q6)\n- STALE は検証状態機械から除外。ハッシュ不一致で参照が外れた証拠に対する **診断ラベル** に降格。検証結果としては証拠なしと同じ NO。",
      "source": {
        "doc": "github:YmSaki/SpecTracer/issues/11",
        "heading": "F6",
        "lines": [
          6,
          6
        ]
      }
    },
    {
      "id": "ROOT-033",
      "statement": "### F7. 状態機械: 8 → 5 (Q7–Q8)\n- 存在資格の基準: **受け取った者(人間/エージェント)の行動が変わるか**。意味の違いは資格にならない。\n- 生存: **PASS / FAIL / MISMATCH / NO_EVIDENCE / UNKNOWN**\n  - PASS → マージ可\n  - FAIL → 実装を直す\n  - MISMATCH → コードを触る前に宣言側(上流)を直す\n  - NO_EVIDENCE → 証拠を作れ(機械で解決可能)\n  - UNKNOWN → 決定論の限界。意味判定できる者へエスカレーション\n- 降格(診断ラベル化): MISSING / NOT_EXECUTED / NOT_CHECKED / STALE ほか。\n- UNKNOWN の検疫: **UNKNOWN ≠ エラー。正常動作としての降参**。内部エラー・入力不正は exit code 2/3 の領分。UNKNOWN をフォールバック先として使う実装は仕様違反。",
      "source": {
        "doc": "github:YmSaki/SpecTracer/issues/11",
        "heading": "F7",
        "lines": [
          7,
          7
        ]
      }
    },
    {
      "id": "ROOT-034",
      "statement": "### F8. 12検証項目の統廃合 (Q9–Q10)\n執行済み(独立検査として消滅):\n- evidence_validity → F5 のハッシュ束縛に吸収 (NO_EVIDENCE)\n- test_execution → cargo 委譲 (F3)。順方向トレースの終端リンク(証拠存在)に畳む\n- vo_decomposition → F4。検査ではなく出力機能\n- semantic_audit → F7。検査ではなく UNKNOWN エスカレーションプロトコル\n- impl_consistency → F5 に吸収 (ハッシュ不一致 = NO_EVIDENCE)\n\n統合:\n- spec_coverage / vo_coverage / test_existence / test_traceability → 一本の **chain_integrity** (宣言鎖の完全性)。どのリンクで切れたかは診断ラベル。\n- static_audit / target_execution → 一本の **target_binding**。静的/動的は同一の問いの2つの証拠源。静的で言えなければ UNKNOWN、動的証拠で昇格。\n\n独立で残存:\n- runtime_result → **oracle_presence**。assertion の存在確認。cargo にバイパスされるのは合否判定であって、oracle の存在確認は vtest 側の静的検査として残る。",
      "source": {
        "doc": "github:YmSaki/SpecTracer/issues/11",
        "heading": "F8",
        "lines": [
          8,
          8
        ]
      }
    },
    {
      "id": "ROOT-035",
      "statement": "### F9. 逆方向トレースは v0.2 (Q10)\n- v0.1 は順方向のみで出荷。README に非関知宣言を一行入れる:\n  「v0.1 は宣言された義務の裏付けのみを検証し、宣言されていない実装の存在は関知しない」\n- 選定理由: スコープ拡大は所有者の既知の悪癖であるため、完成の防衛を優先。",
      "source": {
        "doc": "github:YmSaki/SpecTracer/issues/11",
        "heading": "F9",
        "lines": [
          9,
          9
        ]
      }
    },
    {
      "id": "ROOT-036",
      "statement": "### F10. 文書チェーンの真の意図 (Q11)\n- 所有者の頭の中のチェーンは **要求 → 要件定義 → 基本仕様 → 詳細設計 → VO → (実装, テスト)** の5段。実装済みは SPEC → REQ → VO の3段。この乖離は本セッションまで文書化されていなかった。\n- 12項目増殖の原因: 各遷移に1検査を割り当てる設計思想。ただし全遷移の検査は同型(トレース可能性・漏れ・鮮度)であり、検査の種類は1つ (chain_integrity)。**段はリンクであって検査ではない**。",
      "source": {
        "doc": "github:YmSaki/SpecTracer/issues/11",
        "heading": "F10",
        "lines": [
          10,
          10
        ]
      }
    },
    {
      "id": "ROOT-037",
      "statement": "### F11. 上流文書の v0.1 導入は最小形で「はい」 (Q12)\n- 論拠: MISMATCH の行動指示は「上流を直せ」であり、上流が `.verify/` の外にあると修正先をグラフが指せない。\n- 最小形の内容:\n  - 上流文書は全て **単一の総称ノード型** `document` (id + path + content_hash + 上流参照)\n  - リンクは **derives_from 一種のみ**\n  - chain_integrity はリンク存在とハッシュ照合のみ検証。**内容には関知しない**\n- 入れないもの(スコープ爆発の侵入経路として明示的に拒否):\n  1. 文書種別ごとの専用スキーマ\n  2. 文書間リンクの意味論(関係タイプの増殖)\n  3. 文書内容の良し悪しの検証",
      "source": {
        "doc": "github:YmSaki/SpecTracer/issues/11",
        "heading": "F11",
        "lines": [
          11,
          11
        ]
      }
    },
    {
      "id": "ROOT-038",
      "statement": "### F12. 逆方向トレース = 孤児検出の一般形 (最終)\n- 総称ノード + derives_from の世界では「親を持たないノード」の検出が全レイヤーで同型。過実装検出はその最下層インスタンス。\n- **文書レイヤーの孤児検出**: 実質 null 判定なので v0.1 に含めてよい。\n- **実装レイヤーの孤児検出** (過実装検出): 「何を実装シンボルと数えるか」の未決定が解けるまで v0.2 のまま。この未決定は文書レイヤー導入で 1 ミリも安くなっていない。\n- 注意: F11 の論拠だった「どこまで戻るか」は孤児検出ではなく、張られたリンクの **遡行ナビゲーション** (chain_integrity の診断出力の一部)。混同しないこと。",
      "source": {
        "doc": "github:YmSaki/SpecTracer/issues/11",
        "heading": "F12",
        "lines": [
          12,
          12
        ]
      }
    }
  ],
  "request": [],
  "require": [],
  "spec": [],
  "detailed_spec": [],
  "basic_design": [],
  "design": []
}
