{
  "schema_version": "0.1",
  "root": [
    {
      "id": "ROOT-049",
      "statement": "テストがこれを検証しますよ。で済む問題じゃないの？ ブラックボックステストもホワイトボックステストもテストをするという抽象面では同一であり、動作に対してどのように動いたかを見ればいいし、それが網羅されているものを全部通過したら合格と見做せるわけで。",
      "description": "Owner 裁定 2026-09-07（Issue #14 コメント）。適用（PM、Issue #14 コメントに記載）: (1) Test の実行形態（黒箱 / 白箱、内部 construct 検証 / 境界の振る舞い検証）は分類しない。形態別の規範・形態別の必須条件・形態を宣言するキーを設けない。(2) Test が宣言するのは「何を検証するか」（`covers` → VO）である。`target` は義務ではなく、「どこが動いたか」の観測を束縛する任意の宣言である。`targets` の宣言を Test 成立性の必須条件としない。target を持たない Test の `target_binding` は `NO_EVIDENCE`（診断 `NOT_CHECKED`）とする（`DS-1664`）。宣言された target は既存の到達性規範で検査する。(3) 網羅した検証範囲を全部通過したら合格とする。範囲外・未観測は `PASS` にしない。(4) 「境界形態を宣言するキー」の問い（`reports/boundary-form-observable-2026-09-07.md` §8）は消滅する。\n\n(5) 適用者の開示（2026-09-07、PM の適用方針ではない）: PM の適用方針は `E-SCAN-007` の廃止を含んでいたが、適用していない。同コードは `targets ≥ 1` 専用ではなく、必須 metadata 欠落の一般コードである。`DS-1621`（適用前）「E-SCAN-007はerrorであり、必須metadata（core中立: id / covers ≥ 1 / intent、および当該adapterが必須とする追加metadata…）の欠落を意味する。」、`DS-1256`「`covers` を宣言しない Test は E-SCAN-007 と `chain_integrity = MISMATCH`（診断`MISSING`）になる。」、`DES-229`「adapterはTest構文の違反（重複不可キーの重複、未知キー、必須キーの欠落）をE-SCAN-005 / E-SCAN-006 / E-SCAN-007で報告する」。コードを退役させると、本裁定が触れていない規範（`covers ≥ 1` の強制経路、adapter の構文違反報告）が同時に消える。したがって落としたのは `targets ≥ 1` を必須 metadata とする条項だけであり、コード・`ManagedTestLink::Missing` への写像・`chain_integrity = MISMATCH`（診断 `MISSING`）は無改変である。詳細は `reports/test-form-ruling-2026-09-07.md` §1。",
      "source": {
        "doc": "https://github.com/YmSaki/SpecTracer/issues/14#issuecomment-5565960636",
        "heading": "issuecomment-5565960636",
        "lines": [
          1,
          1
        ]
      }
    }
  ],
  "request": [],
  "require": [],
  "spec": [],
  "detailed_spec": [],
  "basic_design": [],
  "design": []
}
